{
  "authority": "nxb-v11-predecessor-replay-v1",
  "schema_version": 1,
  "status": "passed",
  "repository": "Naveax/nxb-integrity-research-lab",
  "predecessor_main_sha": "1111111111111111111111111111111111111111",
  "predecessor_tree_sha": "2222222222222222222222222222222222222222",
  "observer_successor_head_sha": "3333333333333333333333333333333333333333",
  "run_id": 123456789,
  "run_attempt": 1,
  "artifact_name": "nxb-v11-predecessor-replay-v1-1111111111111111111111111111111111111111-3333333333333333333333333333333333333333-123456789-1",
  "predecessor_policy_sha256": "aaaaaaaaaaaaaaaaaaaaaaaaaaaaaaaaaaaaaaaaaaaaaaaaaaaaaaaaaaaaaaaa",
  "predecessor_source_semantics": "frozen-v1",
  "replay_environment_acquisition": "successor-locked",
  "historical_environment_byte_identity_claimed": false,
  "python_version": "3.12.10",
  "python_executable_sha256": "bbbbbbbbbbbbbbbbbbbbbbbbbbbbbbbbbbbbbbbbbbbbbbbbbbbbbbbbbbbbbbbb",
  "powershell_host_version": "7.6.6",
  "powershell_host_executable_sha256": "cccccccccccccccccccccccccccccccccccccccccccccccccccccccccccccccc",
  "pester_version": "5.7.1",
  "pester_package_sha256": "dddddddddddddddddddddddddddddddddddddddddddddddddddddddddddddddd",
  "psscriptanalyzer_version": "1.25.0",
  "psscriptanalyzer_package_sha256": "eeeeeeeeeeeeeeeeeeeeeeeeeeeeeeeeeeeeeeeeeeeeeeeeeeeeeeeeeeeeeeee",
  "windows_powershell_version": "5.1.19041.6216",
  "windows_powershell_executable_sha256": "ffffffffffffffffffffffffffffffffffffffffffffffffffffffffffffffff",
  "hosted_ci_receipt_sha256": "1111111111111111111111111111111111111111111111111111111111111111",
  "known_error_scan_sha256": "2222222222222222222222222222222222222222222222222222222222222222",
  "pester_ps51_xml_sha256": "3333333333333333333333333333333333333333333333333333333333333333",
  "pester_ps7_xml_sha256": "4444444444444444444444444444444444444444444444444444444444444444",
  "ps51_summary_sha256": "5555555555555555555555555555555555555555555555555555555555555555",
  "run_ps51_sha256": "6666666666666666666666666666666666666666666666666666666666666666",
  "entry_count": 7,
  "predecessor_worktree_clean_after_replay": true,
  "predecessor_head_preserved": true,
  "predecessor_tree_preserved": true,
  "pester_expected_partition_reproduced": true,
  "known_error_findings": 0,
  "analyzer_findings": 0,
  "production_boundary": {
    "private_key_used": false,
    "signer_used": false,
    "tag_mutation": false,
    "release_mutation": false,
    "merge_mutation": false,
    "repository_protection_mutated": false
  }
}
